ID;link;title;article
20;http://www.vertuoconseil.com/portfolio/les-normes-prudentielles-sont-elles-du-protectionnisme/;Les normes prudentielles sont-elles du protectionnisme ?;"Revue Banque – 27 janvier 2016 :La difficulté de mise en conformité des banques des pays émergents avec les derniers standards de solvabilité, de liquidité et de gestion opérationnelle restreint leur accès au marché européen.Dans une décision rendue le 26 janvier 2015, l’Autorité de contrôle prudentiel et de résolution (ACPR) a prononcé, à l’encontre de Bank of Africa France, un avertissement assorti d’une sanction pécuniaire de 100 000 euros. Les 1er mars 2013 et 2 décembre 2013, la Tunisian Foreign Bank et la Banque Châabi du Maroc se voyaient également épinglées par l’ACPR, respectivement à travers un blâme assorti d’une sanction pécuniaire de 700 000 euros et un blâme assorti d’une sanction pécuniaire de 1 million d’euros.Filiales françaises de groupes bancaires africains, ces petites structures ont été sanctionnées pour non-conformité réglementaire de :leurs dispositifs de contrôle interne, de lutte antiblanchiment et de lutte contre le financement du terrorisme (LCB/FT) ;leur niveau de fonds propres ;leur organisation comptable.Déjà déficitaires pour la plupart, ces banques, en pleine stratégie de pénétration sur le marché français, voient la publication du détail des sanctions accentuer l’impact négatif sur leur réputation. Comment expliquer un tel désavantage concurrentiel ?Les règlements prudentiels en barbelés inextricablesLa principale explication de la problématique rencontrée par ces filiales bancaires est leur rattachement à des groupes dont les sièges sociaux sont implantés en dehors des frontières de l’Union européenne, où s’appliquent des règles moins strictes qu’en Europe en matière de régulation bancaire. Il existe donc un gap technique et culturel d’autant plus marqué à franchir lorsque le comité de direction d’une de ces banques décide d’implanter leur établissement sur les marchés européens – stratégie courante visant à demeurer la banque de sa diaspora.banNul n’est censé ignorer la loi ? Certains répondent qu’à l’impossible nul n’est tenu. Quand la loi se compose de milliers d’articles, de templates et se répercute surtout en impacts techniques organisationnels de grande envergure, chacun y va de sa priorisation et de son interprétation.Une supervision différenteL’organisation bancaire de l’Afrique et de la régulation des différents marchés est également une des raisons de la non-conformité des banques émergentes en France : par exemple, l’Afrique n’a pas de régulateur central fort comme la BCE et se trouve organisée en zones bancaires indépendantes, avec des régulateurs locaux par zone, voire par pays. Le régulateur local émet des règlements régissant les différentes banques présentes dans les pays constituant sa zone (UEMOA pour l’Afrique de l’ouest [1] – CEMAC pour l’Afrique centrale [2], etc.). Chaque zone étant indépendante, les régulateurs actualisent les différents règlements bancaires en fonction de la typologie et de la volumétrie des transactions de leur zone, mais surtout en fonction des politiques financières menées par les différents gouvernements des États du périmètre de tutelle. En Afrique, les lois financières et les plans stratégiques des différents États sont plus importants que les règlements bancaires, car ils influencent directement l’activité des banques, alors plus sensibles aux recommandations gouvernementales qu’aux régulateurs locaux. Ces régulateurs deviennent alors moins influents et leur rôle est alors assumé (involontairement ?) par les États.Des régulateurs moins influents, et donc des banques moins rigoureuses ? C’est en tout cas le constat de la difficile adaptation à un environnement réglementaire autrement plus complexe au sein de l’Union européenne. L’organisation financière de l’Afrique affaiblit les régulateurs locaux et confère plus d’importance aux lois étatiques qu’aux règlements bancaires, ce qui reste préjudiciable aux banques voulant s’exporter sur les marchés mieux organisés avec des autorités puissantes : avec un niveau d’exigence réglementaire trop faible au départ (exigence qui culturellement n’existe pas non plus en interne nous allons le voir ensuite), le gap à combler est d’autant plus important au moment de l’export ; l’exposition à la non-conformité s’accroît logiquement.Des modèles économiques incompatiblesAu-delà de l’organisation de la supervision, les difficultés d’adaptation aux règles de l’Union européenne s’expliquent également par la structure bilancielle de ces banques. En France, l’évolution et la précision apportée par les règlements bancaires ces dernières années restent fonction de l’orientation des business models développés par les banques et de la crise financière de 2007-2008. Ces business models ont plutôt évolué vers des modèles de banque universelle, avec, en plus des activités traditionnelles de banque de détail, des activités de banque de financement et d’investissement offrant des produits financiers de plus en plus complexes. Ces modèles entraînent logiquement une augmentation exponentielle des transactions entre pays, sur différents marchés internationaux, une multiplication des prises de risque et une forte exposition au risque systémique. Se basant sur ces nouvelles données, nous assistons ces dernières années à un renforcement des dispositifs de supervision, une surveillance accrue des banques en France afin d’éviter de nouvelles crises. Face à cette recherche de performances des banques à travers la diversification et la globalisation des échanges, les règlements bancaires sont fréquemment actualisés, affinés par les organes de contrôles pour une maîtrise du cadre des transactions.A contrario, le business model des banques africaines est surtout resté traditionnel, avec un PNB basé sur :presque exclusivement des activités de banque de détail ;une petite diversification avec l’avènement du corporate banking ;l’émergence, ces dernières années, du private banking.Ce qui s’avère logique dans un contexte africain affichant un taux de bancarisation globale autour de 11 %. Cette bancarisation reste la priorité des banques africaines avec le développement du crédit classique et, conséquence logique, l’objectif des organes de contrôle reste la mise en place et l’assimilation totale des règlements régissant les activités de la banque de détail. Dès lors, quels besoins de revoir les règlements ? De ce fait, l’implantation d’une banque africaine sur le marché européen nécessite une mise en conformité spécifique de cette filiale puisque ni le siège, qui définit la stratégie d’implantation ni aucune filiale de ce même groupe n’est conforme aux règlements du marché bancaire français.Une culture « risque » encore trop faibleEnfin, les fonctions « risque & conformité » régissant cette veille réglementaire n’ont pas encore trouvé leur place dans les organigrammes des banques « émergentes ». Ces fonctions provenant du système occidental se sont renforcées avec la mise en place de Bâle II dès 2005, puis pleinement imposées au lendemain de la crise financière de 2008. Ces fonctions n’ont pas encore pleinement intégré les organigrammes des établissements financiers des banques issues de pays émergents. Leur positionnement, leur fiche de poste et leur importance sont en cours d’identification pour certaines banques, en cours d’appropriation pour d’autres. Se focalisant sur les organigrammes des groupes bancaires africains qui présentent ces fonctions, leur rattachement hiérarchique qui augure de leur poids et de leur importance dans la chaîne de décision ainsi que la description des activités qui les composent restent propre à chaque banque. D’une banque à une autre, ces fonctions n’ont apparemment pas les mêmes objectifs sachant qu’elles sont structurées autour de la même réglementation. L’absence de ces fonctions ou la non-maîtrise de leurs activités a pour conséquence l’exposition à un risque de non-conformité, donc d’amende et de réputation.Vers un mouvement inverse ?Si l’arrivée de banques émergentes sur nos marchés occidentaux semble ainsi ardue, le chemin inverse ouvre, lui, une voie bien plus lucrative. La dernière AG de l’actionnariat HSBC, fin avril 2015, a été l’occasion pour son président de mettre ouvertement sur la table la question de l’optimisation de l’implantation géographique de son siège social. Le coût d’une telle opération, pourtant astronomique (entre 1,5 et 2,5 milliards d’euros), serait presque aussitôt compensé par l’allégement fiscal qu’HSBC en tirerait. Pas besoin donc de chercher bien loin l’origine d’une telle réflexion : entre le fardeau fiscal (« Bank Levy » à Londres, par exemple) et l’étranglement prudentiel des années postcrise (normes de solvabilité et de liquidité, lois locales de séparations bancaires, par exemple), crise pourtant initiée par des pratiques bancaires, qui rappelons-le, surfaient sur certaines facilités législatives comme par exemple le coût en capital et en liquidité d’opérations de retitrisations complexes (et encore obscures). Les géants de la banque internationale sont prêts à tout, et même à quitter le navire, maintenant que leur bilan a dégonflé, pour ne pas perdre leur liberté et leur marge de manœuvre.Une moindre concurrenceUn crime de lèse-majesté qui devrait alerter les autorités : il illustre une forme de protectionnisme qui finit par se retourner contre soi. Et la construction européenne regorge encore d’autres exemples de ce type. S’il ne s’agit pas de remettre en cause les apports des normes prudentielles, reconnaissons toutefois que le perdant de cette histoire est une fois encore le client final. La concentration bancaire lui est imposée : moins de concurrence est synonyme de moins d’innovation produit et de compétitivité prix. Le comble quand, une fois le marasme 2008-2010 à peu près endigué, ces géants bancaires clamaient à qui voulait l’entendre que l’avenir serait de porter à nouveau le client final au centre de leurs attentions…Par Adrien Aubert, SeniorManager du cabinet VERTUO conseil"
21;http://www.vertuoconseil.com/portfolio/faillites-bancaireset-a-la-fin-les-particuliers-payent/;Faillites bancaires…et à la fin, les particuliers payent;La Tribune – 28 Janvier 2016 :La cacophonie actuelle autour des frais de tenue de comptes nous fait oublier l’entrée en vigueur du mécanisme de résolution unique au 1er janvier 2016, s’appliquant aux faillites bancaires. Simple coïncidence ou orchestration parfaite ? Au menu, la possible ponction des comptes des particuliers, qui sale l’addition autrement que la facturation des comptes courants, laquelle n’était finalement qu’une légère mise en bouche !Est-il encore besoin de rappeler l’ampleur des politiques d’endettement public qui devaient tenter de sauver l’activité économique post crise des subprimes ? Ces tactiques court-termistes se sont traduites dans certains pays européens par une explosion des dépenses partiellement financée par le levier fiscal. Il n’est pas totalement infondé de considérer que les contribuables ont alors indirectement assumé le coût (et aujourd’hui le coup) de la crise pour le compte de certaines banques. Ils sont désormais mis plus directement en première ligne avec l’entrée en vigueur de la « Banking Recovery and Resolution Directive » (BRRD), complétée du règlement « Single Resolution Mechanism », dernières briques de l’Union Bancaire, après le mécanisme de supervision bancaire en place depuis fin 2014, voulue en réponse politique aux déficiences de l’encadrement des activités financières des années 2000.Plusieurs contributeurs pour renflouer les banquesQue sont ces textes ? Pourquoi première ligne ? En réalité, les observateurs diront 3ème ligne car le dispositif de résolution prévoit plusieurs lignes de défense contre la faillite bancaire. En effet, le renflouement des caisses appelle plusieurs contributeurs.En premier lieu, lorsque la capitalisation boursière d’une banque s’effondre en période de crise, les actionnaires (qui peuvent tout à faire être des particuliers à travers des produits d’épargne classique type PEA ou assurance vie…) sont priés de bien vouloir prendre leur courage à deux mains pour réinvestir quelques pièces au prétexte de sauver le monde d’une nouvelle crise financière. Alors, qui se lance le premier ?En second lieu, les créanciersAu second rang figurent les créanciers, autrement dit ceux à qui la banque doit de l’argent. En quoi le renflouement les sollicite ? C’est simple, on efface l’ardoise, on passe en pertes leurs détentions. A l’heure de la lutte contre le risque systémique, à l’heure des participations croisées, des produits dérivés et de la dispersion des obligations dans les multitudes de portefeuilles que compte la sphère financière, le phénomène de contagion laisse perplexe sur la portée de la mesure.… et les particuliersAu troisième rang apparaissent enfin… nous, les particuliers. Avec désormais la possibilité pour la banque de ponctionner les comptes des particuliers pour lesquels le cumul des avoirs au sein d’un même établissement dépasse 100 000€, incluant les contrats d’assurance vie. Notons que, en cas de faillite imminente d’un acteur majeur, il est probable que l’ensemble des places soit dans le rouge et que les performances des fonds investis à travers les assurances vie soient très dégradées, ce qui réduit d’emblée la portée de la mesure. Quant à la question de savoir s’il est pertinent de dépouiller en temps de crise les seules personnes à même de pouvoir investir et injecter de l’argent dans l’économie, pour soit disant une cause plus grande, mieux vaut en fait ne pas se la poser…La question du droit à la propriété privéeLes dépôts inférieurs à ce montant sont eux supposés garantis par le Fonds de Garantie des dépôts bancaires. Supposés car ses réserves s’élevait fin 2014 à un peu plus de 3 milliards d’euros, moins de 1% de l’encours des dépôts à vue en France… Pas de quoi effrayer la majorité des contribuables donc. Mais alors, si la mesure ne concerne qu’une infime minorité de la population, en quoi peut-elle réellement permettre de sauver les meubles ?Après le très agressif discours du Bourget puis les tentatives de fiscalisation jusqu’à 75% des revenus, aurait-elle, elle aussi, uniquement une valeur symbolique de solidarité unilatérale des « riches » envers les « pauvres » ? A tout le moins se pose la question du droit constitutionnel à la propriété privée de l’article 17 de notre Constitution : « La propriété étant un droit inviolable et sacré, nul ne peut en être privé, si ce n’est lorsque la nécessité publique, légalement constatée, l’exige évidemment, et sous la condition d’une juste et préalable indemnité. » Mais quelle indemnité ? Une médaille, une poignée de main et merci pour ce moment (jusqu’au prochain, bien entendu) ? La BCE a une curieuse approche de l’économie du partage.La BCE a déformé les marchésAvec sa politique de « Quantitative Easing », elle avait déjà en 2015 ouvertement déformé les marchés, en injectant de la monnaie à ne plus savoir qu’en faire, à part perturber le cycle économique avec des taux négatifs et biaiser le cours des actions en les réhaussant de façon spectaculaire et décorrélée de la valeur intrinsèque d’une entreprise. Certains verront désormais dans la BRRD une nouvelle opportunité pour se diriger vers des valeurs refuges exemptes du périmètre de la ponction : l’or en premier lieu, mais aussi les œuvres d’art qui disposent de certains privilèges fiscaux en France, tout comme les automobiles de collection (on assiste déjà depuis fin 2014 à une vraie bulle sur la cotation de modèles anciens et parfois mêmes nouveaux). Bref, certains marchés doivent s’apprêter à voir leurs cours flamber.« Tout bien que tu détiens est un souci qui te retient »Et pour nous ôter tous nos soucis, il fallait bien entendu compter sur notre grand gourou bureaucratique, qui fait de cette citation parodique un leitmotiv. Entre mesurette d’avance inefficace et déformation majeure des marchés, la BCE frappe fort pour démarrer une année 2016 déjà bourrée d’incertitudes politiques & économiques, incertitudes toujours peu propices à l’investissement à un moment où les économies européennes sont à un tournant technologique, social et environnemental. La seule certitude, c’est qu’entre innovations fiscales ou ponctions de leurs comptes, à la fin ce sont toujours les mêmes qui payent.Par Adrien Aubert, SeniorManager du cabinet VERTUO conseil
22;http://www.vertuoconseil.com/portfolio/le-offshoring-durgence-ou-la-necessaire-evolution-des-business-models/;Le offshoring d’urgence ou la nécessaire évolution des business models;Les Echos – 18 février 2016 :La conférence des Nations Unies pour la lutte contre le changement climatique relance la question de la résilience économique. Tandis que certains y voient simplement une nécessaire révision des stratégies de continuité d’activité, d’autres parlent de modifications plus profondes du business.La COP21 fait partie de ces nombreux événements qui viennent nous rappeler que tout niveau de résilience est en permanence remis en jeu. Que l’on parle de plans de continuité d’activité ou de stratégies de recouvrement, l’enjeu de la résilience demeure le maintien d’un niveau d’activité assurant à la banque de ne pas «couler» à court terme.À l’heure de la réduction des coûts et des programmes d’efficience opérationnelle, la tendance est à la révision des stratégies de continuité et à la recherche de solutions à la fois économiques et efficientes. Le grand vainqueur en la matière est le fameux «cross back-up» ou l’offshoring temporaire et d’urgence des processus critiques. Si l’idée est séduisante, beaucoup argumentent qu’elle est utopique, car elle se heurte à de nombreux obstacles techniques, fonctionnels et humains.Prenons l’exemple d’une société A implantée en Europe et en Asie. Suite à un incendie dans les locaux parisiens, La Cellule de crise Française se convoque et décide de déclencher la procédure de repli dite de «cross back-up». Les processus critiques sont alors envoyés à Tokyo pour une durée indéterminée.Si les systèmes informatiques communiquent, si les processus réceptionnés sont traitables à Tokyo, si la charge de travail est absorbable localement sans affecter le volume et la qualité japonaise et si les procédures et compétences humaines sont similaires, le Groupe A peut avec conviction informer ses clients, ses actionnaires et ses contreparties que l’activité ne souffrira pas de cet incident.De nombreuses conditions sont donc nécessaires afin de garantir une solution de cross back-up d’urgence efficace qui de plus respecte la durée maximale d’interruption admissible (les fameux RTO : Recovery Time Objectives ou durée d’interruption absorbable par le métier).Les exigences et la stratégie semblent particulièrement complexes, mais la solution reste néanmoins viable et moins consommatrice que certaines dans son implémentation. Reste à l’adresser correctement et à absorber les changements organisationnels majeurs qu’une telle solution implique.Mappemonde et ventilation des processus critiquesD’un point de vue technique, les plateformes, outils et applications utilisés doivent être les mêmes en France et au Japon, sinon interfacés de manière à garantir :le transfert de données sans pertela reprise effective du travail.L’exigence fonctionnelle porte ensuite sur la correspondance des activités de Paris et de Tokyo qui doivent être identiques sur les deux sites, supposant par ailleurs que les compétences des Français soient maîtrisées par les Japonais.Dans un second temps, l’étude de faisabilité doit envisager plusieurs localisations cibles, identifier les processus délocalisables ainsi que les compétences essentielles associées, les processus périphériques existants et les RTO correspondants. Ce travail effectué, l’étude valide systématiquement via une campagne de tests de charge la liste des processus délocalisables ainsi que les pays cibles et leur niveau d’absorption. In fine c’est une cartographie mondiale des activités critiques avec correspondance de compétences, de capacité et de durée maximale de prise en charge qui doit apparaitre.Contraintes et évolutions managérialesD’un point de vue managérial, de telles stratégies viennent indéniablement challenger les méthodes actuelles. En évoquant une délocalisation des processus, l’éclatement des équipes et donc la gestion de la production et des compétences à distance, le management dématérialisé devient une réalité. Or, même si on parle de offshoring temporaire, la responsabilité de l’activité demeure au site nominal. L’exigence de résilience porte donc véritablement sur un suivi et des contrôles qui, surtout en temps de crise, nécessitent d’être renforcés, et ce d’autant plus si la situation est amenée à durer.Une connaissance approfondie du métier et des activités est alors indispensable et permet de définir un protocole de contrôles garantissant le même niveau de maîtrise des risques que sur le site nominal. Cette étape de l’analyse est incontestablement la plus complexe dans l’exercice de mise en place de la stratégie de offshoring. Elle suggère in fine une évolution radicale des méthodes de gestion et de contrôle qui s’inscrivent dans une époque dite de digitalisation n’ayant aucune limite géographique.Face aux conséquences du changement climatique et de manière beaucoup plus générale dans l’idée de répondre à des besoins de résilience de plus en plus importants et imprévisibles, les réponses les plus cohérentes semblent être la capitalisation géographique et la multiplication des stratégies de repli. Loin d’être irréalisable, le cross back-up temporaire nécessite une analyse poussée et un investissement financier qui effrayent tant ce projet de nomadisme à échelle mondiale pourrait accélérer une modification profonde des business models actuels.Au-delà de la simple délocalisation des activités et de «l’harmonisation» des compétences humaines, en permettant une maîtrise internationale des processus critiques et en faisant du management dématérialisé une réalité, le cross back-up s’inscrit inévitablement dans une logique d’évolution managériale exigeant une transformation inéluctable des modes de pensées et de gestion.Catherine Epinat Consultante du cabinet Vertuo Conseil
