ID;link;title;article
64;http://www.vertuoconseil.com/portfolio/anacredit-lueur-despoir-banques/;AnaCredit, une lueur d’espoir pour les banques ?;Revue Banque– 24 février 2017 :L’Analytical Credit Dataset, ou AnaCredit, est un projet européen, piloté par la BCE en appui sur le Système Européen des Banques Centrales, qui vise à établir une base de données détaillées sur la distribution de crédit au sein de l’Union Européenne. Après la publication du règlement le 18 mai dernier cadrant les grands principes de la collecte, les institutions financières, principaux vecteurs d’alimentation de la base, ont reçu début novembre les premiers éléments méthodologiques du Manuel AnaCredit, comportant notamment les détails fonctionnels sur la détermination du périmètre éligible (typologies de clientèles et d’opérations). Encore une contrainte règlementaire? Oui mais certains préfèrent souligner l’autonomie potentielle que ces données vont accorder à la BCE, donc une fin possible à l’escalade prudentielle entamée en 2007.Il ne faut pas s’y tromper. AnaCredit est en premier lieu un rapport règlementaire obligatoire pour les banques de taille systémique et établit de nouveaux standards. En termes de périmètre, le règlement se veut exhaustif des lignes de crédits octroyées, à l’exception des encours inférieurs à 25000€ et des prêts aux personnes physiques qui sont, pour le moment, exclus de la livraison. Si la centaine d’informations granulaires demandées ne dépaysera pas les équipes rodées à leur manipulation (notamment depuis les AQR 2014, un gigantesque audit mené par la BCE pour marquer sa prise de fonction par une évaluation des actifs bancaires), les modalités de livraison sont, elles, plus surprenantes.En effet, le règlement définit autant de jeux de données que de thématiques métier (par exemple, un jeu de données comptables ou un jeu de données relatives aux garanties reçues), et chaque jeu de données, en plus d’une remise trimestrielle, peut faire l’objet d’une demande ad hoc de la part du superviseur national (en France, il s’agit de l’Autorité de Contrôle Prudentiel & Résolution, émanation de la Banque de France). Une demande ad hoc consisterait par exemple à demander la fourniture des jeux de données 4 et 9 le 23 du mois sur une filiale d’affacturage, et non plus à un niveau consolidant le plus élevé sur un arrêté mensuel ou trimestriel.Ce fonctionnement fixe donc de nouvelles exigences en termes de flexibilité, tant du point de vue organisationnel que technique. Car de nombreuses équipes fournissent aujourd’hui un effort très conséquent une fois par trimestre sur une courte période pour produire une importante batterie de reportings réglementaires, avec des outils alimentés encore souvent alimentés une fois par mois ou même une seule fois par trimestre. Or demain, ces équipes pourront être sollicitées au jour le jour, comme lors des exercices Fire Drill menés par la BCE à l’automne dernier, et devront disposer dans leurs outils habituels de la vision Risque la plus fraîche possible, c’est-à-dire d’une photographie du portefeuille datant de la veille voire du jour même pour les opérations de marché.Encore plus de données, encore plus de flux, encore plus de volume d’informations, encore plus de contraintes sur les délais (le superviseur allemand cible une remise à J+6 en situation courante), il s’agit bien d’un nouveau défi technique à relever pour des banques en pleine mutation technologique, avec à la clef un nouvel enjeu de conformité, la production AnaCredit étant obligatoire dès le quatrième trimestre 2017. Pour ne laisser planer aucun doute sur le sujet, le règlement, à travers l’article 18, prévoit d’ores et déjà la possibilité de sanctionner, à la fois par la BCE mais également par le superviseur local, les établissements qui seraient dans l’incapacité de justifier le non-respect de leurs obligations de déclarations statistiques. Avec des amendes allant de 10000 à 200000€ selon la typologie d’anomalie (du simple retard de livraison jusqu’à l’obstruction dans l’audit des résultats par la BCE) relevée à chaque sollicitation, la BCE place la barre haute.Pas vraiment d’inquiétude cependant, car au-delà de la menace, les banques systémiques ont tout intérêt à jouer le jeu. Car pour elles, produire l’AnaCredit ne sera que le fruit de la profonde refonte de leur infrastructure entamée depuis quelques années, poussée par l’évolution des besoins de clients, les innovations technologiques ainsi que le renforcement des exigences réglementaires comme celles liées à la pratique des reportings risques (parmi lesquelles la circulaire BCBS239 figure en tête). Cette adaptation a conduit les banques à se doter de gigantesques hubs de données très hétérogènes, avec des définitions normalisées à l’échelle de leur groupe et donc partagées avec leurs filiales & succursales, des référentiels enfin administrés de façon pro-active, des plans de contrôles plus souvent pertinents. Mieux, le panel de données collectées, qui se chiffre par centaines, a été conçu de manière anticipative, de façon à adresser l’ensemble des futurs besoins réglementaires, tels que les normes IFRS9 ou l’AnaCredit aux échéances similaires.De plus, à travers l’enrichissement d’une super base de données relatives aux crédits et au risque de crédit, AnaCredit a vocation à faciliter le travail de la BCE en termes de production de statistiques économiques, d’analyses prudentielles et d’arbitrages sur les impacts des politiques monétaires notamment en termes de coût du crédit et de défaillances d’entreprises. Cette base de données, alimentée de façon industrielle et automatisée, offre surtout la possibilité à la BCE et aux Banques Centrales Nationales de mener leurs propres analyses à distance, sans systématiquement passer par de coûteuses missions d’inspection locales ou de nouveaux reportings complexes à exploiter. Cela n’enlève rien aux discussions quasi permanentes entre les autorités et les établissements supervisés, mais cela permet a minima de soulager ces derniers d’une charge de production chronophage et à faible valeur ajoutée. Et si 2017 sera l’année de l’AnaCredit «v0», il se conçoit aisément, à la manière d’un logiciel ou d’applications pour smartphone, des versions ultérieures de l’AnaCredit. Une v1 puis une v2 et ainsi de suite pour étoffer le périmètre, le nombre et la typologie de données collectées: ce nouveau mode de fonctionnement permet aux autorités de glaner des informations très granulaires en lieu et place des reportings réglementaires qui fourmillent d’indicateurs très agrégés. De là à rêver de la fin de l’escalade prudentielle, il n’y a qu’un pas… et sans doute encore beaucoup de marge!Par Adrien AUBERT, Senior Managerdu cabinet VERTUO conseil
65;http://www.vertuoconseil.com/portfolio/loptimisation-couts-consequence-collaterale-lean-six-sigma-entreprise/;L’optimisation des coûts :  Conséquence collatérale du Lean Six sigma en entreprise;"Nous sommes dans un contexte où tout va très vite et la concurrence est tellement forte que chaque entreprise se doit de se différencier, de proposer un produit ou service qui satisfait la demande du client et ce, au meilleur prix.C’est exactement l’objectif que tend à atteindre le Lean Six sigma; méthodologie issue de la fusion entre le «Lean management» et «Six sigma»; deux démarches qui ont largement fait leurs preuves:Mis en place en 1950 chez Toyota, Le «Lean management» tire son essence de la méthodologie Lean qui avait pour objectif l’accélération du flux. Le Lean a ensuite évolué vers une démarche visant à travailler en continue sur tout le(s) processus de l’entreprise: le Lean management. L’objectif est d’éliminer tous les types de gaspillage qui ont une influence négative sur le cycle de production. Cela permet ainsi d’augmenter la qualité, de diminuer le temps de déroulement du processus, de réduire les coûts de production pour l’entreprise et donc d’augmenter sa rentabilité. Aujourd’hui, cette méthode s’étend à tous les types d’entreprises (produits ou services), par l’utilisation d’outils simples et visuels1.Créée en 1979 chez Motorola, le «Six sigma» est une méthode d’analyse statistique qui permet à l’entreprise d’améliorer la qualité des processus de production (existants ou nouveaux) en limitant les sources de variation aux normes acceptées par le client. Cette méthode s’applique sur les procédures métiers «mesurables»; peu importe le secteur d’activité de l’entreprise, en se concentrant principalement sur une brique du processus. En augmentant la qualité des processus, l’entreprise produit mieux, plus efficacement; ce qui a pour conséquence d’optimiser ses coûts2.Les deux méthodologies présentées ci-dessus sont orientées «processus» avec pour préoccupation principale la satisfaction du client.Dans la méthodologie Lean Six sigma, le point de départ est la mesure de l’attente du client afin de pouvoir évaluer la performance attendue (les limites de variation du processus) pour que l’entreprise puisse satisfaire ce même client. Le niveau de performance de l’entreprise est calculé grâce au nombre de défauts par million d’opportunités (issu de la méthodologie Six sigma). Prenons l’exemple d’une grande entreprise ferroviaire. L’objectif du Lean Six sigma n’est pas de dire que les trains sont réguliers (attente des clients) mais de confirmer que les trains sont conformes aux besoins exprimés par le client (si le train est en retard alors il devient nécessaire d’informer sur le motif ainsi que communiquer les informations sur les prochains trains). Par la suite, l’entreprise pourra mettre en place des actions correctives qui permettront d’améliorer le(s) processus.En ce qui concerne l’optimisation des coûts dans une entreprise, on aborde cette notion à partir du moment où celle-ci réalise des actions qui ont pour objectif d’améliorer sa rentabilité et donc de réduire ses coûts.Les actions mises en place dans le cadre des projets Lean Six sigma ayant pour vocation de garantir la satisfaction client, en agissant sur la qualité et les délais, l’optimisation des coûts est une résultante quasiment systématique. C’est en cela que l’on peut dire que la réduction des coûts fait partie intégrante de la démarche Lean Six sigma dans le cadre d’un programme de Transformation d’entreprise.Une démarche orientée client qui impacte la productivité de l’entrepriseLe Lean Six sigma favorise la «prévention» (anticiper les défauts de production) plutôt que la «détection» (déceler les défauts liés à la production) car comme le dit l’adage mieux vaut «prévenir» que «guérir»; cela coûte moins cher! La règle du 1€/10€/100€ est souvent citée: une dépense de 1€ en amont évite 10€ pour la correction d’un défaut en fin de processus et jusqu’à 100€ de correction du défaut sur un produit livré.Pour ce faire, le Lean Six sigma s’appuie sur la démarche DMAIC du Six sigma (Définir Mesurer Analyser Innover Contrôler). Dans cette démarche, chacune des étapes combine les outils des méthodes «Six sigma» et «Lean management». Dans la démarche DMAIC, la phase la plus importante lorsque l’on aborde l’optimisation des coûts est la phase «Contrôle» car c’est elle qui permet de mettre sous contrôle les processus afin d’éviter que la performance optimale ne baisse.Cette méthodologie a largement été éprouvée dans le domaine de l’industrie et son application a facilement été transposée au niveau des processus des entreprises du secteur tertiaire; étant donné que les préoccupations de la satisfaction client, de qualité, de délai et de rentabilité restent les mêmes. Cela fait une dizaine d’année que les banques et les compagnies d’assurances déploient le «Lean Six sigma» au sein de leurs organisations: Axa avec son programme Axa Way, Areva et son programme Areva Way ou BNPP avec ACE.Les outils statistiques du «Six sigma» ont vocation à améliorer la fiabilité du processus en proposant une méthode de résolution des problèmes et de contrôle: de la qualité des services (causes de réclamation) et de leur efficacité (comparaison entre la productivité de 2 équipes).Par exemple, le FMEA(Failure Mode & Effect Analysis) est un outil qui détermine les problèmes possibles dans un processus, leurs fréquences et leurs effets. De là, des propositions d’actions concrètes découleront de la part de l’équipe projet. Celles-ci seront ensuite contrôlées afin de garantir l’amélioration de la situation.Quant au «Lean management», il propose des outils d’analyse du processus et d’actions d’accompagnement simples, visuels et efficace qui peuvent être mises en place rapidement et ce, sans attendre la fin du projet (exemples: mise à jour de procédures, adaptation de procédures comme les check list ou communications opérationnelles).Taïchi Ohno, à l’origine du système «Toyota», a identifié les 7 sources de gaspillage sur lesquelles l’entreprise peut agir afin de réduire ses délais de production, de stockage, de quantité…Tous ces types de gaspillage représentent un coût supplémentaire pour l’entreprise qui, s’ils étaient supprimés ou diminués, permettraient de diminuer les coûts de production et donc d’augmenter la rentabilité de l’entreprise et ce, sans impact sur la qualité.D’autres outils issus de la méthodologieLean management comme le waste walk (outil permettant d’identifier les retards dans le processus et les solutions possibles), le line balance (équilibrer les tâches du flux de production entre les différents acteurs afin de limiter le risque d’engorgement qui provoque trop souvent des retards) ont pour conséquence d’améliorer la performance du processus analysé et donc de diminuer les coûts de production.D’autres outils comme les 5S (Sort, Shine, Sustain, Standardize, Set in order: trier, nettoyer, pérenniser, standardiser et mettre en ordre) font partie des outils pouvant être utilisés dans le Lean Six sigma car ils permettent d’optimiser directement les espaces de production.Tous ces outils ont pour objectif d’analyser les processus ou la performance de l’entreprise afin d’en faire ressortir des actions d’amélioration. Un impact direct sur la productivité de l’entreprise devrait être observé et qui dit augmentation de la production dit baisse des coûts pour l’entreprise.Toutes ces optimisations peuvent avoir des conséquences sur l’organisation et les salariés de l’entreprise qu’il est donc indispensable d’accompagner.La culture de l’entreprise revisitéeLa réduction des coûts est souvent associée à la réduction de la masse salariale et donc aux licenciements entraînant une augmentation de la charge de travail.Avec la méthodologie Lean Six Sigma, on ne parle plus uniquement de quantité produite mais on parle de «perception client» et de «qualité»; ce qui nécessite une évolution des mentalités au sein même de l’entreprise.Les employés sont davantage sollicités afin d’atteindre ce niveau de performance, lié au niveau de sigma, souhaité pour satisfaire le client et anticiper les défauts/rebus de production.Dans cette situation, il est primordial de s’assurer que le bien-être au travail, dit «confort opérationnel» ne s’est pas détérioré. En effet, les gains observés à moyens termes seraient eux aussi impactés négativement si la volonté des salariés de bien faire leur travail était ébranlée.Toujours concernant les salariés, un facteur clé de succès de la démarche Lean Six sigma est bien la formation des parties prenantes et donc des salariés impactés par le projet. En effet, il est important que les employés comprennent que les outils mis en œuvre pour atteindre le ou les objectif(s) de l’entreprise ne sont que des moyens et qu’il est donc primordial de s’investir jusqu’à la phase de «Contrôle» du projet (moment où l’on mesure l’atteinte ou non des objectifs).La formation de la ligne managériale est aussi un enjeu majeur car cela permet d’éviter les freins et les blocages liés à l’application de la méthodologie et des outils associés au sein de l’organisation. Connaître la méthodologie et les outils de la méthode est une chose mais savoir les appliquer et les utiliser en environnement de production en est une autre.Il est indispensable pour l’entreprise de trouver un juste équilibre entre l’analyse statistique et la mise en œuvre d’actions concrètes. En effet, la gestion par les chiffres risque d’éloigner les managers de la réalité du terrain et de faire passer au second plan la mise en œuvre des actions concrètes qui sont le facteur clé de succès de la méthode.C’est bien l’association d’actions d’optimisation des processus, au travers l’analyse de ses imperfections, et la réduction des défauts de production, par l’analyse statistique, qui vont permettre à l’entreprise d’améliorer la satisfaction client.Dans le cadre d’une transformation bien menée, l’optimisation des coûts pour l’entreprise est une conséquence directe de l’amélioration des processus (qualité et délais) permettant ainsi de réduire le cycle et la charge de production des produits et services.Par Emilie LOPEZ, consultante Senior du cabinet VERTUO conseil1 Pour en savoir plus sur le Lean management: livre «Le management Lean» de Michael Ballé (2013)2 Pour en savoir plus sur le Six sigma: livre «Six sigma – Comment l’appliquer» de Maurice Pillet (2013)"
66;http://www.vertuoconseil.com/portfolio/nearshoring-vs-offshoring-tendance-2017/;Nearshoring vs. Offshoring : quelle est la tendance pour 2017 ?;La période comprise entre 2011 et 2014 a été active en termes de délocalisation des activités des entreprises françaises à l’étranger. Le rapport publié par l’INSEE le 12 juin 2013 estime à 20.000 le nombre d’emplois supprimés sur le sol français dû aux délocalisations sur cette période de 3 ans. C’est un chiffre important, largement repris dans la presse, mais qui fait échos aux 20.000 emplois que la France détruisait annuellement 10 ans plus tôt. Il est donc important de ne pas tirer de conclusion trop hâtive à la lecture des résultats statistiques.L’argument numéro un mis en avant par les entreprises qui délocalisent leurs activités est le prix de la main d’œuvre. Rien qu’au sein de l’Union Européenne, les coûts horaires de main d’œuvre varient de 4,10 € (Bulgarie) à 41,30€ (Danemark) soit 10 fois plus cher. La France se situant à 35,10€ (chiffres Eurostat 2015). Mais les salaires ne sont pas le seul argument: coûts commerciaux (transport notamment), coûts de production (charges sociales), rapprochement avec des entreprises ayant déjà délocalisé, recherche d’environnements stables (facilité d’embauche, flexibilité de l’emploi, qualification des salariés, etc.) sont des critères également importants dans ce choix stratégique.Au sein des établissements financiers, si le secteur de l’ITO (Information Technology Outsouring) a été historiquement plébiscité (datacenters, centres de développements, de recette). Aujourd’hui, c’est celui de BPO (Business Process Outsourcing) qui concentre l’essentiel des demandes. Conserver les services «Front Office» en France et délocaliser toutes les autres fonctions en dehors du territoire ne pose en effet aucune difficulté. Et inutile de penser que toutes les activités partent pour un seul et même pays: Royal Bank of Scotland a ainsi choisi de délocaliser sa comptabilité en Pologne, alors que l’IT est largement sous-traité en Inde. Les systèmes d’information étant interconnectés, les échanges d’information s’opèrent de manière fluide, et ne posent aucune difficulté théorique. D’autant que les économies financières réalisées sont substantielles, et capables de gommer un service client dégradé.En Europe, c’est le Luxembourg qui a adopté une réelle stratégie de communication en vue d’attirer les entreprises souhaitant délocaliser. L’excellente stabilité politique, financière et législative permet facilement aux entrepreneurs de se projeter durablement. D’autres pays reviennent en force et notamment l’Irlande qui, après un épisode tourmenté ces dernières années, concentre effectivement une grande partie des services des fonds d’investissement. Délocaliser son activité en Irlande, c’est également se rapprocher des acteurs influents et des partenaires certifiés et ainsi profiter d’une expertise très localisée. Côté Maghreb, c’est le Maroc qui est historiquement le partenaire privilégié de la France, et ce, malgré un ralentissement des activités de nearshoring ces dernières années (source Office des Changes). Secteur stratégique au Maroc, le Plan « Offshoring 2016-2020 » a été adopté et offre de belles perspectives pour les acteurs français et marocains.Pour les multinationales, 2016 a marqué un temps d’arrêt dans les annonces de délocalisation de leurs activités en dehors de l’hexagone. La proximité des élections présidentielles en France expliquant très certainement ce phénomène.Sans être repris par les politiques, des entreprises annoncent régulièrement rapatrier toute ou partie de leurs activités en Europe. Cela a été le cas d’AXA en 2016 avec l’annonce de la fin de ses activités de production informatique à Bangalore. En cause ? Un turnover des salariés trop important impactant la qualité de services rendus.Retour du protectionnisme?Si l’échiquier mondial des délocalisations ne devrait pas être bouleversé en 2017, celui des délocalisations américaines semble pour l’instant à l’arrêt. Les annonces du nouveau président Américain Donald Trump du 4 décembre 2016 ont en effet mis à l’arrêt certaines velléités de grands groupes: Ford vient ainsi d’annoncer l’abandon de son usine au Mexique au profit d’un site dans le Michigan. General Motors n’a pas encore annoncé l’arrêt de son projet vers le Mexique également. Quant à Toyota, il était le 6 janvier dernier dans les radars du Président Trump qui menaçait le géant japonais de barrières douanières dissuasives. Simples effets d’annonces ou réelles intentions de modifier les règles du jeu, 2017 marquera sans aucun doute un retour au protectionnisme qu’il soit américain ou chinois.Le choix des entrepreneurs restera certes souverain, mais à quel prix? Celui des menaces? 2017 sera très certainement une année de transition où les aspirations nationalistes se feront entendre bien plus fort qu’auparavant. Le dernier mot appartiendra aux consommateurs qui se montrent plus attentifs que jamais à la provenance de leurs achats (source Credoc).Définition:La délocalisation peut s’entendre sous deux formes les plus communément admises:Nearshoring: délocalisation d’une activité économique dans une zone géographique proche, permettant un contrôle des délais de livraison et de la qualité de la prestation fournie (moins de surprises).Offshoring: délocalisation d’une activité économique dans une zone géographique généralement éloignée où la main d’œuvre est très bon marché par rapport au pays d’origine.Par Sébastien BOUDARD, ProjectManagerdu cabinet VERTUO Conseil
67;http://www.vertuoconseil.com/portfolio/rd-le-lab-vertuo-organise-le-22-mars-prochain-son-premier-seminaire-de-restitution/;R&D – Le LAB Vertuo organise le 22 mars prochain son premier séminaire de restitution;Vertuo Conseil, cabinet de conseil en organisation et management spécialisé dans les secteurs de la Banque – Finance – Assurance, a initié fin 2015 une démarche de Recherche & Développement afin de se doter d’une vision concrète de la banque de demain et ainsi pérenniser son expertise métier.A l’issue de sa première année de R&D, le LAB Vertuo organise le 22 mars prochain son premier séminaire de restitution.Cette conférence du LAB Vertuo a pour objectif de partager avec des acteurs prestigieux les résultats d’une première année d’études autour des risques de financement dubusiness modelbancaire, en partenariat avec la House of Finance de Dauphine et Revue Banque. L’ACPR, BPIFrance ainsi que Geolia Leasing Solutions viendront enrichir de leurs points de vue les analyses du LAB Vertuo, une équipe pluri-disciplinaire composée de consultants, de clients, d’étudiants, de chercheurs, dont l’ambition est d’apporter une compréhension de la banque de demain, de ses enjeux et de son environnement.Pour vous inscrire à cette conférence, cliquez ici.
68;http://www.vertuoconseil.com/portfolio/square-se-hisse-a-la-6eme-place-du-classement-2016-des-entreprises-de-500-salaries/;Square se hisse à la 6ème place du classement 2016 des entreprises de +500 salariés;Pour la sixième année consécutive, Square figure au palmarès français des « Best Work Places in France » en se hissant à la 6ème place du classement 2016 des entreprises de +500 salariés établi par l’Institut indépendant Great Place To Work® !
