ID;link;title;article
0;http://www.vertuoconseil.com/portfolio/devenir-faussaire-les-autorites-nous-guident-pas-a-pas/;Devenir faussaire ? Les autorités nous guident pas à pas!;A la veille de la sortie du nouveau billet de 20€, prévue pour le 25 Novembre, les chiffres de la BCE sont plus parlants que jamais : 838 000 fausses coupures ont été retirées de la circulation en 2014, soit 25% de plus qu’en 2013, le billet de 20 euros étant le plus contrefait.Cette même BCE qui, sur son site internet, nous précise les signes de sécurité de ce nouveau billet de 20€, dont le graphisme devrait être moins imitable. Nous y retrouvons donc les signes de sécurité du billet, selon 3 techniques : le « toucher », le « regarder » et le « incliner » (TRI). En bonus, nous avons même droit à des « signes supplémentaires », tels que les propriétés à retrouver sous une lampe UV ou à infrarouge!Dans ce contexte, peut-on, dans un souci de transparence permanent, publier officiellement ces informations, accessibles à tous, et donc aux plus malintentionnés ?Par ailleurs, dans son bulletin officiel du 29 août 2014, le ministère de la justice présente son plan de coordination pénale afin de lutter efficacement contre la contrefaçon de monnaie : améliorer la circulation de l’information, choisir des qualifications pénales pertinentes, mieux gérer les scellés. Ainsi, dans son désir de mieux coordonner les différents éléments, il met en exergue les failles de la justice sur le sujet et surtout, nous livre en annexe, la liste des produits pouvant servir à contrefaire les billets de banque !Le ministère de la justice énumère donc les produits, les classe par matériau et par signe de sécurité : Spray coiffant pour cheveux, Gouache blanche conditionnée en tube Stylo réservoir avec de l’encre invisible fluorescente sous UV, Vernis à ongle à effet optique de différentes couleurs, et la liste est longue. Plus de 60 produits listés ! Et il nous informe également que seulement certains de ces produits sont déjà utilisés par les contrefacteurs. Cela signifie-t-il que, s’ils sont à court d’idées, ils peuvent se sourcer dans le Bulletin Officiel ?Autant nous fournir une Edition illustrée « Pour les nuls » !Peut-on, dans un désir de communication continu, dresser une liste de produits accessibles dans le commerce, et dans le même temps, se déresponsabiliser du phénomène ?L’information aujourd’hui est accessible de tous, partout, sur de nombreux supports. Internet, cet « open space virtuel », est une mine d’informations et surtout, une plateforme d’échanges sur le sujet.Les faux billets se commande sur internet, les transactions sont payées anonymement (carte bancaires prépayées, Bitcoins…) et même le cachet de la poste prouvant la provenance est trafiqué ! Autant dire que la tâche est rude et qu’elle n’est nullement facilitée par Internet.Caractérisé par une accessibilité importante des informations à bas coût, Internet donne les moyens à l’individu et aux groupes d’individus de penser que «tout voir» et « tout savoir » est la norme. De ce fait, un sentiment de puissance s’est installé auprès des internautes, laissant croire que la transparence est obligatoire dans un monde perçu comme plus complexe et surtout incertain.La transparence devient opérante si elle est utilisée pour maintenir et entretenir la confiance, et on doit pouvoir identifier quels savoirs partager.Les pouvoirs publics ne peuvent pas tout dévoiler, mais ils ont comme mission de reconquérir la confiance des individus et surtout, de l’entretenir. Cela ne doit pas passer nécessairement par la diffusion d’informations sensibles, prioritaires ou qui peuvent porter préjudices à leurs travaux et enquêtes.Car une fois que le processus de transparence est enclenché, il faut savoir en éviter les pièges, vis-à-vis du public. En effet, la transparence permanente dévoile une demande accrue du public, qu’il faut informer et avec qui il faut entretenir une relation de confiance qui induit un engagement permanent. Par ailleurs, en atteignant ce niveau de détail, on crée d’autres interrogations et attentes chez le public, qui peuvent rester sans réponses.La transparence dans la communication doit poser des limites. C’est comme la chambre des parents: il n’est pas bon de laisser tout voir.Par Hind Aqallal, Consultante Seniordu cabinet VERTUO conseil
1;http://www.vertuoconseil.com/portfolio/un-entretien-avec-aurelien-lachaud-responsable-du-pole-innovation-et-nouveaux-usages-la-banque-postale/;Un entretien avec Aurélien Lachaud, Responsable du Pôle Innovation et Nouveaux Usages (La Banque Postale);Qu’est ce qu’un wallet ?Le wallet inspire de nombreuses définitions dont certaines le limitent à une solution de paiement sur Internet. Cette définition réductrice peut être largement étayée par celle de la Banque de France : « Une solution permettant à un utilisateur de confier à un tiers, jugé de confiance, des données de paiement et des données personnelles, stockées en vue d’effectuer ultérieurement notamment des ordres de paiement. ». Le wallet ne se limite donc pas à un simple moyen de paiement sur Internet. Celui-ci a une vocation multicanale (paiement en ligne et paiement de proximité), multi-devices (ordinateur, mobile, tablette), multi-services et multi-usages (intégration des cartes de fidélité, cartes de paiement, coupons, bons plans, etc.) permettant de répondre à tous les nouveaux besoins des clients particuliers et commerçants.Il existe deux grands types de wallet :le wallet commerçant tels que Fivory (Crédit Mutuel-CIC) et Flash’N Pay (Oney Banque Accord)le wallet émetteur tels que Paylib, V.me by Visa et MasterPass par MasterCard.Comment définir la solution de paiement Paylib en quelques mots ?Paylib est un service innovant lancé en septembre 2013 par BNP Paribas, la Société Générale et La Banque Postale. Celui-ci sera également proposé en 2015 par le Crédit Mutuel Arkéa et le Crédit Agricole qui rejoindront le consortium Paylib.Ce nouveau service de paiement permet aux clients d’effectuer des achats en ligne sans avoir à saisir leurs coordonnées bancaires quel que soit le device utilisé : ordinateur, mobile ou tablette. Le sous-jacent de la transaction est une carte bancaire.Paylib est un système de paiement, dit « 4 coins », permettant d’apporter aux clients les avantages de la carte (assurance voyage, prolongation garantie constructeur, etc.) et aux commerçants de simplifier leur transaction sur leur site Internet (gestion des litiges, back office, etc.).Quel est le bénéfice client de souscrire à une telle offre ?Le paiement via la solution Paylib est simple, accessible et sécurisé.Le client ne saisit pas ses données de cartes bancaires à l’enrôlement et lors de chaque transaction. La banque est le tiers de confiance auquel le client confie ses données de cartes bancaires.De plus, la banque est l’unique interlocuteur du client assurant la gestion des cas de litiges/fraudes.La banque du client détenant le service Paylib est donc le garant, et reste le gestionnaire exclusif au même titre que dans le cadre des moyens de paiement traditionnels.A ce jour, cette solution de portefeuille numérique satisfait déjà près de 300 000 clients particuliers et 700 e-commerçants partenaires (dont vente-privee.com, voyages-sncf.com, billetreduc.com, priceminister.com, showroomprive.com, etc).Comment se différencie le portefeuille numérique Paylib comparativement à d’autres wallets comme Paypal ?Paylib est un moyen de paiement français, commercialisé par plusieurs banques en France, et créé pour leurs clients afin de couvrir leurs besoins et leurs usages bancaires connus. Face à l’augmentation croissante de la fraude sur les paiements en ligne, la banque endosse son rôle de tiers de confiance en garantissant les transactions effectuées par les clients depuis la solution Paylib.La promesse marketing principale est donc d’assurer la sécurité des moyens de paiement du client. La sécurité et la confiance, que se doit d’inspirer une banque, constituent un avantage concurrentiel important par rapport à certains concurrents. Ainsi, chaque banque est en charge de la relation commerciale avec ses clients. Paylib a pour objectif de renforcer la relation bancaire entre les clients et leur banque en se constituant comme un vrai outil de fidélisation.Comment se démarque la solution Paylib afin de capter/conquérir des grandes enseignes du e-commerce ? Quels sont les nouveaux services associés à Paylib ?Paylib offre un parcours client optimal et sécurisé. Pour chaque transaction réalisée, le wallet offre la garantie de paiement et donc la sécurité financière aux commerçants.La solution a été conçue pour répondre aux nouveaux besoins des commerçants et pour faciliter les achats en ligne multi-devices. Ainsi, Paylib étend son acceptation à l’international grâce à un accord avec MasterPass (solution de paiement numérique de MasterCard). Courant 2015, les utilisateurs de Paylib pourront donc payer chez plus de 60 000 commerçants MasterPass participants dans 13 pays dans le monde.L’intégration de Paylib dans les applications smartphone est également à l’étude.Quel est l’avenir du wallet ?L’objectif d’un wallet est de simplifier la vie quotidienne d’un client.Il est difficile d’imaginer des solutions de paiement indépendantes les unes des autres. Le succès du wallet passe forcément par une convergence des différents services de paiement. A terme, les banques devront proposer un produit qui permettra de réunir tous les services de paiement actuellement proposés.Il est cependant trop tôt pour savoir quelle forme prendra cette convergence.Aurélien Lachaud – Responsable du Pôle Innovation et Nouveaux – La Banque PostalePropos recueillis par Sandie Baureilles et Marion Chabrier, consultantes VERTUO Conseil
2;http://www.vertuoconseil.com/portfolio/le-paiement-etat-de-lart-dun-marche-innovant/;Le paiement : état de l’art d’un marché innovant;Les Echos–13 février 2015 :Aujourd’hui, dans le secteur bancaire, le domaine des moyens de paiement est l’un des plus prometteurs, grâce notamment aux avancées technologiques et à la démocratisation du Smartphone. En effet, si aujourd’hui nous payons globalement comme hier, il ne fait aucun doute que nous payerons différemment demain. Pour l’heure, nous sommes face à un certain nombre d’évolutions, prémices d’une révolution.Une révolution du paiement mobile qui se fait attendreLe paiement mobile sans contact NFC (Near Field Communication) suscite de nombreux espoirs dans le secteur bancaire français, particulièrement en termes de nouveaux usages et de services à valeur ajoutée : fidélité, couponing, offres dédiées géolocalisées, etc. Pourtant, celui-ci tarde à s’imposer, car il se heurte encore à un certain nombre de freins.En premier lieu, des problématiques d’ergonomie du parcours client lors de l’enrôlement, ainsi que des problématiques d’interopérabilité ont vu le jour, notamment concernant le TSM (Trusted Services Manager), «fournisseur de services de confiance» pour le paiement mobile. Ensuite, un écosystème peu lisible et un positionnement flou de certains acteurs sur la chaîne de valeur qui ont mis en lumière un business model complexe et encore peu rémunérateur.Côté technique, on observe un environnement qui se cherche, avec une multitude de technologies qui coexistent : microSD, SIMcentric, Secure Element, QR Code, BLE (Bluetooth Low Energy), HCE (Host Card Emulation), etc. À ce jour, aucune d’entre elles n’a émergé en tant que standard de marché.Enfin, on constate qu’un certain nombre de pilotes et d’expérimentations ne revêt pas un caractère suffisamment universel pour permettre le succès et l’adoption à grande échelle d’un nouveau mode de paiement.L’espoir d’un décollage du NFC sous l’impulsion d’AppleApple, numéro 2 mondial derrière Samsung sur le marché des Smartphones, mais dont la notoriété et l’influence sur ce marché sont extrêmement fortes avait, jusqu’à l’iPhone 5, toujours refusé d’inclure la technologie NFC dans ses mobiles. L’arrivée de l’iPhone 6, doté de cette technologie, laisse penser que le virage NFC est en passe d’être pris. Néanmoins, il convient de rester prudent et de noter que des points d’interrogation subsistent à propos d’Apple Pay et de son Touch ID.Lancé d’abord aux États-Unis, il ne fait aucun doute qu’Apple Pay arrivera dès que possible sur le marché français. Mais cela pourrait être plus compliqué au regard des différences notables entre les marchés du paiement français et américain, en particulier concernant l’aspect sécuritaire, la France ayant des standards plus exigeants (norme EMV). L’iPhone 6 se heurtera également à une problématique de taux d’équipement due au coût de l’appareil.Enfin se pose la question des alliances et partenariats. Outre-Atlantique, Apple a déjà conclu des partenariats avec des schemes (Visa, MasterCard et American Express), des banques (Bank of America, Citigroup, JPMorgan Chase, Wells Fargo, etc.) et des enseignes de premier plan (Subway, McDonald’s, Disney, Nike, etc.).En France, la tâche risque d’être plus complexe et on peut penser que les négociations avec les banques ne seront pas aisées, particulièrement sur les commissions, dans un contexte de forte pression règlementaire Européenne entraînant une érosion des interchanges.Quoi qu’il en soit, le nouveau choix stratégique d’Apple concernant le NFC va dynamiser le marché du paiement mobile en forçant les autres acteurs à proposer des solutions concurrentes rapidement. En outre, ces acteurs vont devoir se montrer créatifs face à Apple qui a les moyens de devenir un acteur majeur sur la chaîne de valeur du paiement. Grâce à ses 800 millions de comptes iTunes et données associées, Apple a une longueur d’avance dans la course aux données clients, clé des services à valeur ajoutée.Une croissance lente des paiements sans contactPour l’heure, c’est le paiement sans contact par carte qui doit «ouvrir la voie» au mobile et entrer dans les habitudes des consommateurs : la récente campagne de publicité du GIE Cartes bancaires «Poser, c’est payé» va dans ce sens.Ce marché du sans contact est en croissance, mais reste aujourd’hui encore un marché de niche, comme en attestent les derniers chiffres du GIE CB (à fin décembre 2014) : 45,9 % des cartes CB sont sans contact, 19,7 % des terminaux le sont, mais ils ne totalisent que 1,52 % des paiements (en volume)… Notons que la barre symbolique des 1 % de paiements sans contact avait été franchie pour la première fois en octobre dernier.Les paiements par carte sans contact s’établissent en moyenne aux alentours de 11 € et sont, rappelons-le, limités unitairement à 20 €.Activité soutenue sur les marchés du wallet et du mPOSDans l’attente de la révolution du paiement mobile, les banques françaises se positionnent sur deux marchés. Premièrement, le wallet (ou portefeuille numérique), dont tout le monde connaît le plus célèbre : PayPal. Destiné à ce jour au paiement en ligne, le wallet va pouvoir bénéficier du dynamisme du marché du e-commerce français, 6e marché mondial, avec un Chiffre d’Affaires de 56,8 milliards d’euros en 2014, en hausse de 11 % par rapport à l’année précédente (source Fevad).Les banques françaises ont donc lancé le «wallet français», Paylib, via le consortium BNP Paribas, La Banque Postale, Société Générale, qui sera rejoint prochainement par le Crédit Mutuel Arkéa et le Crédit Agricole. Même si ce produit est voué à évoluer en termes de services à valeur ajoutée, il a aujourd’hui le mérite de reconstruire l’interbancarité française et d’éviter la «guerre des boutons» de paiement sur les sites de e-commerce…Deuxième marché très actif, le marché du mPOS (mobile Point Of Sale), où un Smartphone est utilisé comme support d’acceptation du paiement par carte. Cette solution qui permet de transformer le Smartphone ou la tablette du commerçant en un terminal de paiement s’adresse principalement aux petits marchands et marchands ambulants (artisans, médecins, taxis, livreurs, etc.) non équipés de TPE, principalement pour des raisons de coût et de durée d’engagement.Les solutions de mPOS peuvent également adresser des commerçants de plus grande taille, déjà équipés de matériel classique, afin de proposer des points d’acceptation supplémentaires tout en véhiculant une image innovante. Ce marché est sans doute le plus innovant aujourd’hui et, contre toute attente, c’est du côté des commerçants que le mobile est en train de faire évoluer les usages en matière de paiement.En 2014, Dilizi de BPCE, Mobo de BNP Paribas ou encore la solution de w-HA, filiale d’Orange, ont vu le jour sur le marché français. Les solutions Smart TPE du Crédit Agricole, Monem Mobile de LCL et Monetico Mobile du Crédit Mutuel-CIC arrivent sur le marché à leur tour.Vers une mutation de l’acte de paiementIl devient aujourd’hui difficile de recenser l’ensemble des initiatives innovantes liées au paiement tant elles sont nombreuses : utilisation des réseaux sociaux (paiement par Twitter de BPCE), authentification vocale (Talk to Pay de La Banque Postale), biométrie (Natural Security Alliance), etc. Il apparaît pourtant de plus en plus clairement que l’on peut résumer l’enjeu de l’innovation sur le marché des paiements à travers l’ambition exprimée par PayPal : «Faire disparaître complètement l’acte de paiement»…Karim Terbeche,Project Manager, VERTUO Conseil
